{
  "schema_version": "2.3",
  "ledger_state": "RECERTIFIED",
  "post": "why-insight-isnt-change.md",
  "source_path": "src/content/posts/why-insight-isnt-change.md",
  "source_sha256": "84d85a3b72f9a2486eb65c7e1313fbd0303e0e823c72c57e85d3038e9c887108",
  "legacy_audit_path": "quality-engine/audits/nigredo/why-insight-isnt-change.md-nigredo-audit.md",
  "claims": [
    {
      "anchor": {
        "line_start": 65,
        "line_end": 65,
        "quote": "It is a description of three forces that must co-arise"
      },
      "claim_mode": "HOUSE-MODEL",
      "claim_status": "COHERENT",
      "remediation_codes": [
        "KEEP"
      ],
      "math": {
        "role": "LOAD-BEARING",
        "load_bearing": true,
        "locks": {
          "correctness": "PASS",
          "consequence": "PASS",
          "provenance": "PASS"
        },
        "evidence_eligible": true
      },
      "requires_review": false,
      "rationale": "Kha–Ba–La is explicitly declared as the article’s house diagnostic; all three forces and their independent failure conditions are defined, and the core intervention logic depends on the triad.",
      "legacy": {
        "anchor": "L65",
        "quote": "\"It is a description of three forces that must co-arise\"",
        "type": "math",
        "verdict": "INTEGRATED",
        "load_bearing": true,
        "note": "Kha-Ba-La triad operates the post's core model; per-force failure modes are derived from it. House canon, structural grammar."
      },
      "id": "C001"
    },
    {
      "anchor": {
        "line_start": 79,
        "line_end": 79,
        "quote": "The nervous system still executes the old branch."
      },
      "claim_mode": "DECLARED-METAPHOR",
      "claim_status": "DECLARED",
      "remediation_codes": [
        "KEEP"
      ],
      "requires_review": false,
      "math": {
        "role": "ANALOGICAL",
        "load_bearing": false,
        "locks": {
          "correctness": "NOT-APPLICABLE",
          "consequence": "NOT-APPLICABLE",
          "provenance": "NOT-APPLICABLE"
        },
        "evidence_eligible": false
      },
      "rationale": "“The nervous system executes the old branch” operates inside the article’s explicitly named runtime model; it is a computing comparison with no literal code or neural-program mechanism inferred.",
      "legacy": {
        "anchor": "L79",
        "quote": "\"The nervous system still executes the old branch.\"",
        "type": "science",
        "verdict": "GROUNDED-OBSERVATIONAL",
        "load_bearing": false,
        "note": "Embodied, reader-replicable observation (knowing better yet doing it anyway); body as instrument, no matter-first causal claim — not INVERTED."
      },
      "id": "C002"
    },
    {
      "anchor": {
        "line_start": 89,
        "line_end": 89,
        "quote": "Not because it is poetic, but because it is recursive."
      },
      "claim_mode": "DERIVED-SYNTHESIS",
      "claim_status": "CONTRADICTED",
      "remediation_codes": [
        "R-MATH",
        "R-METAPHOR"
      ],
      "math": {
        "role": "WRONG",
        "load_bearing": false,
        "locks": {
          "correctness": "FAIL",
          "consequence": "PASS",
          "provenance": "FAIL"
        },
        "evidence_eligible": false
      },
      "requires_review": false,
      "rationale": "Repeated analogous structure across personal, relational, institutional, and cultural scales is not recursion in the mathematical or computational sense; no recurrence rule, self-call, or base case is defined.",
      "legacy": {
        "anchor": "L89",
        "quote": "\"Not because it is poetic, but because it is recursive.\"",
        "type": "math",
        "verdict": "INTEGRATED",
        "load_bearing": false,
        "note": "Self-similar scaling is demonstrated across four named levels (personal→cosmic); house fractal/correspondence frame, correctly used."
      },
      "id": "C003"
    },
    {
      "anchor": {
        "line_start": 97,
        "line_end": 97,
        "quote": "In relation, the pattern doubles. One person's default meets another's default, and they form a circuit. You see this in couples who both \"understand\" their attachment styles intellectually but still enact the same pursuit-withdrawal sequence every time one partner is tired. The knowledge is there. The runtime is not."
      },
      "claim_mode": "DIRECT-OBSERVATION",
      "claim_status": "UNSUPPORTED",
      "remediation_codes": [
        "R-SCOPE",
        "R-SOURCE"
      ],
      "requires_review": false,
      "math": {
        "role": "NONE",
        "load_bearing": false,
        "locks": {
          "correctness": "NOT-APPLICABLE",
          "consequence": "NOT-APPLICABLE",
          "provenance": "NOT-APPLICABLE"
        },
        "evidence_eligible": false
      },
      "rationale": "The couples example may reflect practice observation, but no observer, cases, conditions, or scope are recorded; reader familiarity cannot substitute for the direct-observation minimum evidence.",
      "legacy": {
        "anchor": "L97",
        "quote": "\"'understand' their attachment styles intellectually but still enact the same pursuit-withdrawal sequence\"",
        "type": "science",
        "verdict": "GROUNDED-OBSERVATIONAL",
        "load_bearing": false,
        "note": "\"You see this in couples who…\" — reader-replicable; framework named descriptively with meta-critical scare quotes, no institution invoked."
      },
      "id": "C004"
    },
    {
      "anchor": {
        "line_start": 113,
        "line_end": 113,
        "quote": "The Type 5-style pattern preserves distance. The tax is isolation."
      },
      "claim_mode": "HOUSE-MODEL",
      "claim_status": "COHERENT",
      "remediation_codes": [
        "KEEP"
      ],
      "requires_review": false,
      "math": {
        "role": "NONE",
        "load_bearing": false,
        "locks": {
          "correctness": "NOT-APPLICABLE",
          "consequence": "NOT-APPLICABLE",
          "provenance": "NOT-APPLICABLE"
        },
        "evidence_eligible": false
      },
      "rationale": "“Type 5-style” explicitly marks Enneagram vocabulary as a pattern shorthand inside the house model, and the distance/isolation tradeoff is internally consistent without claiming validated typology.",
      "legacy": {
        "anchor": "L113",
        "quote": "\"The Type 5-style pattern preserves distance. The tax is isolation.\"",
        "type": "science",
        "verdict": "GROUNDED-OBSERVATIONAL",
        "load_bearing": false,
        "note": "Enneagram-style typology as openly-framed pattern shorthand (\"-style\"); same construction for Type 8 and Type 9. No geometry claimed, no authority borrowed; sits in declared-analogy safe harbor."
      },
      "id": "C005"
    }
  ]
}
