{
  "schema_version": "2.3",
  "ledger_state": "RECERTIFIED",
  "post": "the-fool-before-the-leap.md",
  "source_path": "src/content/posts/the-fool-before-the-leap.md",
  "source_sha256": "3fb4c72a426436be6b01380612978f9c1c655cf8c2a70f77222d7eac5bb05e5f",
  "legacy_audit_path": "quality-engine/audits/nigredo/the-fool-before-the-leap.md-nigredo-audit.md",
  "claims": [
    {
      "id": "C001",
      "anchor": { "line_start": 22, "line_end": 22, "quote": "Every spiral begins with a fool who doesn't know they're beginning." },
      "claim_mode": "HOUSE-MODEL",
      "claim_status": "COHERENT",
      "remediation_codes": ["KEEP"],
      "requires_review": false,
      "math": { "role": "NONE", "load_bearing": false, "locks": { "correctness": "NOT-APPLICABLE", "consequence": "NOT-APPLICABLE", "provenance": "NOT-APPLICABLE" }, "evidence_eligible": false },
      "rationale": "The post's thesis maxim, operated consistently with the spiral/Fool vocabulary used across the corpus; functions as a declared interpretive frame rather than an empirical universal.",
      "legacy": { "anchor": "none — blind pass", "quote": "Every spiral begins with a fool who doesn't know they're beginning.", "type": "science", "verdict": "NOT FLAGGED (§5 safe harbor)", "load_bearing": false, "note": "New coverage finding from Albedo v2.3.1 blind raw-source extraction; legacy nigredo audit intentionally not consulted per blind-pass rule." }
    },
    {
      "id": "C002",
      "anchor": { "line_start": 24, "line_end": 24, "quote": "In the Thoth deck, the Fool is depicted mid-leap, surrounded by symbols of every card that will follow. The crocodile of the Moon. The tiger of Lust." },
      "claim_mode": "TRADITIONAL-SOURCE",
      "claim_status": "ATTRIBUTED",
      "remediation_codes": ["R-SCOPE"],
      "requires_review": false,
      "math": { "role": "NONE", "load_bearing": false, "locks": { "correctness": "NOT-APPLICABLE", "consequence": "NOT-APPLICABLE", "provenance": "NOT-APPLICABLE" }, "evidence_eligible": false },
      "rationale": "The Thoth Fool (Frieda Harris / Book of Thoth) does include the crocodile and tiger and is densely symbolic; 'symbols of every card that will follow' overstates the case — the card is rich in symbolism but is not an index of all 21 subsequent trumps.",
      "legacy": { "anchor": "none — blind pass", "quote": "In the Thoth deck, the Fool is depicted mid-leap", "type": "science", "verdict": "NOT FLAGGED (§5 safe harbor)", "load_bearing": false, "note": "New coverage finding from Albedo v2.3.1 blind raw-source extraction; legacy nigredo audit intentionally not consulted per blind-pass rule." }
    },
    {
      "id": "C003",
      "anchor": { "line_start": 26, "line_end": 26, "quote": "The annamaya kosha — the physical body, the food sheath" },
      "claim_mode": "TRADITIONAL-SOURCE",
      "claim_status": "ATTRIBUTED",
      "remediation_codes": ["KEEP"],
      "requires_review": false,
      "math": { "role": "NONE", "load_bearing": false, "locks": { "correctness": "NOT-APPLICABLE", "consequence": "NOT-APPLICABLE", "provenance": "NOT-APPLICABLE" }, "evidence_eligible": false },
      "rationale": "Annamaya kosha as the food-formed physical sheath is the standard Vedantic gloss (Taittiriya Upanishad lineage); the term is used accurately.",
      "legacy": { "anchor": "none — blind pass", "quote": "The annamaya kosha — the physical body, the food sheath", "type": "science", "verdict": "NOT FLAGGED (§5 safe harbor)", "load_bearing": false, "note": "New coverage finding from Albedo v2.3.1 blind raw-source extraction; legacy nigredo audit intentionally not consulted per blind-pass rule." }
    },
    {
      "id": "C004",
      "anchor": { "line_start": 26, "line_end": 26, "quote": "Bags packed. Ticket booked. The body was already in motion when the mind was still rehearsing reasons." },
      "claim_mode": "DIRECT-OBSERVATION",
      "claim_status": "VERIFIED",
      "remediation_codes": ["KEEP"],
      "requires_review": false,
      "math": { "role": "NONE", "load_bearing": false, "locks": { "correctness": "NOT-APPLICABLE", "consequence": "NOT-APPLICABLE", "provenance": "NOT-APPLICABLE" }, "evidence_eligible": false },
      "rationale": "Bounded first-person report of the author's own departure sequence; observer, actions, and ordering are specified without generalization in this span.",
      "legacy": { "anchor": "none — blind pass", "quote": "The body was already in motion when the mind was still rehearsing reasons.", "type": "science", "verdict": "NOT FLAGGED (§5 safe harbor)", "load_bearing": false, "note": "New coverage finding from Albedo v2.3.1 blind raw-source extraction; legacy nigredo audit intentionally not consulted per blind-pass rule." }
    },
    {
      "id": "C005",
      "anchor": { "line_start": 28, "line_end": 28, "quote": "the leap happens *before* the justification. The rational mind constructs the narrative of decision — pros and cons, risk assessment, opportunity cost — but the body had already decided." },
      "claim_mode": "EMPIRICAL-CORRELATE",
      "claim_status": "UNSUPPORTED",
      "remediation_codes": ["R-SCOPE", "R-SOURCE"],
      "requires_review": false,
      "math": { "role": "NONE", "load_bearing": false, "locks": { "correctness": "NOT-APPLICABLE", "consequence": "NOT-APPLICABLE", "provenance": "NOT-APPLICABLE" }, "evidence_eligible": false },
      "rationale": "Generalized from one personal episode into a universal psychological law ('the body had already decided... the mind follows, drafting a story'); adjacent to confabulation and post-hoc rationalization research but asserted without source, scope, or measure.",
      "legacy": { "anchor": "none — blind pass", "quote": "the body had already decided... the mind follows, drafting a story about choice", "type": "science", "verdict": "NOT FLAGGED (§5 safe harbor)", "load_bearing": false, "note": "New coverage finding from Albedo v2.3.1 blind raw-source extraction; legacy nigredo audit intentionally not consulted per blind-pass rule." }
    },
    {
      "id": "C006",
      "anchor": { "line_start": 30, "line_end": 30, "quote": "It's departure from a *frequency* — the resonant pattern of automatic living, inherited rhythms, unexamined assumptions running at the operating-system level." },
      "claim_mode": "HOUSE-MODEL",
      "claim_status": "COHERENT",
      "remediation_codes": ["KEEP"],
      "requires_review": false,
      "math": { "role": "NONE", "load_bearing": false, "locks": { "correctness": "NOT-APPLICABLE", "consequence": "NOT-APPLICABLE", "provenance": "NOT-APPLICABLE" }, "evidence_eligible": false },
      "rationale": "The 'frequency/OS-level pattern' vocabulary is the corpus's declared interpretive frame for habit and conditioning, used consistently; no literal radio-frequency or software claim is made.",
      "legacy": { "anchor": "none — blind pass", "quote": "departure from a frequency — the resonant pattern of automatic living", "type": "science", "verdict": "NOT FLAGGED (§5 safe harbor)", "load_bearing": false, "note": "New coverage finding from Albedo v2.3.1 blind raw-source extraction; legacy nigredo audit intentionally not consulted per blind-pass rule." }
    },
    {
      "id": "C007",
      "anchor": { "line_start": 32, "line_end": 32, "quote": "The alchemical principle of *solve* — dissolve what isn't essential before *coagula* can crystallize what is." },
      "claim_mode": "TRADITIONAL-SOURCE",
      "claim_status": "ATTRIBUTED",
      "remediation_codes": ["KEEP"],
      "requires_review": false,
      "math": { "role": "NONE", "load_bearing": false, "locks": { "correctness": "NOT-APPLICABLE", "consequence": "NOT-APPLICABLE", "provenance": "NOT-APPLICABLE" }, "evidence_eligible": false },
      "rationale": "Solve et coagula is a genuine alchemical maxim (dissolve and coagulate), and the gloss — dissolution precedes recombination — is faithful to the tradition.",
      "legacy": { "anchor": "none — blind pass", "quote": "The alchemical principle of solve — dissolve what isn't essential before coagula can crystallize what is.", "type": "science", "verdict": "NOT FLAGGED (§5 safe harbor)", "load_bearing": false, "note": "New coverage finding from Albedo v2.3.1 blind raw-source extraction; legacy nigredo audit intentionally not consulted per blind-pass rule." }
    },
    {
      "id": "C008",
      "anchor": { "line_start": 34, "line_end": 34, "quote": "Zero. The number that makes all other numbers possible. The silence that makes all sound meaningful. The emptiness that makes all form visible." },
      "claim_mode": "DECLARED-METAPHOR",
      "claim_status": "DECLARED",
      "remediation_codes": ["KEEP"],
      "requires_review": false,
      "math": { "role": "ANALOGICAL", "load_bearing": false, "locks": { "correctness": "NOT-APPLICABLE", "consequence": "NOT-APPLICABLE", "provenance": "NOT-APPLICABLE" }, "evidence_eligible": false },
      "rationale": "Zero is used in an openly aphoristic parallel structure (number/silence/emptiness) as a contemplative comparison; no literal mathematical theorem is asserted and no numeric inference follows.",
      "legacy": { "anchor": "none — blind pass", "quote": "Zero. The number that makes all other numbers possible.", "type": "math", "verdict": "NOT FLAGGED (§5 safe harbor)", "load_bearing": false, "note": "New coverage finding from Albedo v2.3.1 blind raw-source extraction; legacy nigredo audit intentionally not consulted per blind-pass rule." }
    }
  ]
}
