{
  "schema_version": "2.3",
  "ledger_state": "RECERTIFIED",
  "post": "three-layer-consciousness-stack.md",
  "source_path": "src/content/posts/three-layer-consciousness-stack.md",
  "source_sha256": "b8686117009510766b93bf9d5ac502d15c2e2f89a0513d580c81b0bbf2672ebe",
  "legacy_audit_path": "quality-engine/audits/nigredo/three-layer-consciousness-stack.md-nigredo-audit.md",
  "claims": [
    {
      "anchor": {
        "line_start": 39,
        "line_end": 39,
        "quote": "The body's own telemetry"
      },
      "claim_mode": "HOUSE-MODEL",
      "claim_status": "COHERENT",
      "remediation_codes": [
        "KEEP"
      ],
      "requires_review": false,
      "math": {
        "role": "NONE",
        "load_bearing": false,
        "locks": {
          "correctness": "NOT-APPLICABLE",
          "consequence": "NOT-APPLICABLE",
          "provenance": "NOT-APPLICABLE"
        },
        "evidence_eligible": false
      },
      "rationale": "The local frame is explicit, its operative terms are defined, and the row is internally consistent without claiming external proof. No mathematical object is evidential. Legacy evidence reviewed: Declared framing of pre-verbal somatic sensation; reader-replicable in practice, no authority invoked.",
      "legacy": {
        "anchor": "L39",
        "quote": "\"The body's own telemetry\"",
        "type": "science",
        "verdict": "GROUNDED-OBSERVATIONAL",
        "load_bearing": true,
        "note": "Declared framing of pre-verbal somatic sensation; reader-replicable in practice, no authority invoked."
      },
      "id": "C001"
    },
    {
      "anchor": {
        "line_start": 41,
        "line_end": 41,
        "quote": "the nervous system's current configuration. Fight, freeze, flow"
      },
      "claim_mode": "EMPIRICAL-CORRELATE",
      "claim_status": "UNSUPPORTED",
      "remediation_codes": [
        "R-SCOPE",
        "R-SOURCE"
      ],
      "requires_review": false,
      "math": {
        "role": "NONE",
        "load_bearing": false,
        "locks": {
          "correctness": "NOT-APPLICABLE",
          "consequence": "NOT-APPLICABLE",
          "provenance": "NOT-APPLICABLE"
        },
        "evidence_eligible": false
      },
      "rationale": "The testable claim lacks a method-matched source, conditions, uncertainty, or warranted causal strength. No mathematical object is evidential. Legacy evidence reviewed: Autonomic-state vocabulary tied to directly observable body states; no institutional support claimed.",
      "legacy": {
        "anchor": "L41",
        "quote": "\"the nervous system's current configuration. Fight, freeze, flow\"",
        "type": "science",
        "verdict": "GROUNDED-OBSERVATIONAL",
        "load_bearing": true,
        "note": "Autonomic-state vocabulary tied to directly observable body states; no institutional support claimed."
      },
      "id": "C002"
    },
    {
      "anchor": {
        "line_start": 47,
        "line_end": 53,
        "quote": "This stack is Kha-Ba-La in diagnostic mode"
      },
      "claim_mode": "HOUSE-MODEL",
      "claim_status": "COHERENT",
      "remediation_codes": [
        "KEEP"
      ],
      "math": {
        "role": "LOAD-BEARING",
        "load_bearing": true,
        "locks": {
          "correctness": "PASS",
          "consequence": "PASS",
          "provenance": "PASS"
        },
        "evidence_eligible": true
      },
      "requires_review": false,
      "rationale": "The local frame is explicit, its operative terms are defined, and the row is internally consistent without claiming external proof. The mathematical/computational structure is correct, consequential, and provenanced in the cited region. Legacy evidence reviewed: Canonical triadic structure; Signal=Ba / State=La / Story=Kha is the post's operating architecture, each layer demonstrated in its own section.",
      "legacy": {
        "anchor": "L47–53",
        "quote": "\"This stack is Kha-Ba-La in diagnostic mode\"",
        "type": "math",
        "verdict": "INTEGRATED",
        "load_bearing": true,
        "note": "Canonical triadic structure; Signal=Ba / State=La / Story=Kha is the post's operating architecture, each layer demonstrated in its own section."
      },
      "id": "C003"
    },
    {
      "anchor": {
        "line_start": 61,
        "line_end": 61,
        "quote": "the reaction fires at Signal speed — 80 milliseconds"
      },
      "claim_mode": "EMPIRICAL-CORRELATE",
      "claim_status": "UNSUPPORTED",
      "remediation_codes": [
        "R-DELETE",
        "R-SCOPE",
        "R-SOURCE"
      ],
      "requires_review": false,
      "math": {
        "role": "DECORATIVE",
        "load_bearing": false,
        "locks": {
          "correctness": "PASS",
          "consequence": "FAIL",
          "provenance": "FAIL"
        },
        "evidence_eligible": false
      },
      "rationale": "The testable claim lacks a method-matched source, conditions, uncertainty, or warranted causal strength. The mathematical/computational term fails the removal test and is not evidence. Legacy evidence reviewed: Suspiciously round, sourceless timing statistics (80 ms vs 800 ms) asserted as measurement with no study, instrument, or observation protocol; the qualitative ordering (signal before story) is observable, the exact figures are not.",
      "legacy": {
        "anchor": "L61",
        "quote": "\"the reaction fires at Signal speed — 80 milliseconds\"",
        "type": "science",
        "verdict": "FABRICATED",
        "load_bearing": false,
        "note": "Suspiciously round, sourceless timing statistics (80 ms vs 800 ms) asserted as measurement with no study, instrument, or observation protocol; the qualitative ordering (signal before story) is observable, the exact figures are not."
      },
      "id": "C004"
    },
    {
      "anchor": {
        "line_start": 67,
        "line_end": 67,
        "quote": "In high cortisol state, only threat-signals pass the filter"
      },
      "claim_mode": "EMPIRICAL-CORRELATE",
      "claim_status": "UNSUPPORTED",
      "remediation_codes": [
        "R-CAUSE",
        "R-SCOPE",
        "R-SOURCE"
      ],
      "requires_review": false,
      "math": {
        "role": "NONE",
        "load_bearing": false,
        "locks": {
          "correctness": "NOT-APPLICABLE",
          "consequence": "NOT-APPLICABLE",
          "provenance": "NOT-APPLICABLE"
        },
        "evidence_eligible": false
      },
      "rationale": "The testable claim lacks a method-matched source, conditions, uncertainty, or warranted causal strength. No mathematical object is evidential. Legacy evidence reviewed: Cortisol named as the condition determining perception — chemistry-before-experience; gate watch-lists cortisol-as-cause constructions. State can be described phenomenologically instead.",
      "legacy": {
        "anchor": "L67",
        "quote": "\"In high cortisol state, only threat-signals pass the filter\"",
        "type": "science",
        "verdict": "INVERTED",
        "load_bearing": false,
        "note": "Cortisol named as the condition determining perception — chemistry-before-experience; gate watch-lists cortisol-as-cause constructions. State can be described phenomenologically instead."
      },
      "id": "C005"
    },
    {
      "anchor": {
        "line_start": 67,
        "line_end": 67,
        "quote": "In parasympathetic coherence, the same signal reads as information"
      },
      "claim_mode": "EMPIRICAL-CORRELATE",
      "claim_status": "UNSUPPORTED",
      "remediation_codes": [
        "R-CAUSE",
        "R-SCOPE",
        "R-SOURCE"
      ],
      "requires_review": false,
      "math": {
        "role": "NONE",
        "load_bearing": false,
        "locks": {
          "correctness": "NOT-APPLICABLE",
          "consequence": "NOT-APPLICABLE",
          "provenance": "NOT-APPLICABLE"
        },
        "evidence_eligible": false
      },
      "rationale": "The testable claim lacks a method-matched source, conditions, uncertainty, or warranted causal strength. No mathematical object is evidential. Legacy evidence reviewed: Same structure as the cortisol clause: a named physiological state made the determinant of how signal reads; the felt shift is observable, the chemistry-as-gatekeeper framing is the inversion.",
      "legacy": {
        "anchor": "L67",
        "quote": "\"In parasympathetic coherence, the same signal reads as information\"",
        "type": "science",
        "verdict": "INVERTED",
        "load_bearing": false,
        "note": "Same structure as the cortisol clause: a named physiological state made the determinant of how signal reads; the felt shift is observable, the chemistry-as-gatekeeper framing is the inversion."
      },
      "id": "C006"
    }
  ]
}
