{
  "schema_version": "2.3",
  "ledger_state": "RECERTIFIED",
  "post": "you-dont-need-more-frameworks.md",
  "source_path": "src/content/posts/you-dont-need-more-frameworks.md",
  "source_sha256": "5fa26298d0c4fd89d1614ad5a25e6b17a45d449591f2aaefebab55986f7822f2",
  "legacy_audit_path": "quality-engine/audits/nigredo/you-dont-need-more-frameworks.md-nigredo-audit.md",
  "claims": [
    {
      "anchor": {
        "line_start": 44,
        "line_end": 44,
        "quote": "- Identity defense = kernel permissions (La blocking its own examination)"
      },
      "claim_mode": "DECLARED-METAPHOR",
      "claim_status": "DECLARED",
      "remediation_codes": [
        "KEEP"
      ],
      "requires_review": false,
      "math": {
        "role": "NONE",
        "load_bearing": false,
        "locks": {
          "correctness": "NOT-APPLICABLE",
          "consequence": "NOT-APPLICABLE",
          "provenance": "NOT-APPLICABLE"
        },
        "evidence_eligible": false
      },
      "rationale": "The identity-defense/kernel-permissions equation belongs to the post’s sustained and unmistakably non-literal computing comparison; no literal software mechanism is inferred.",
      "legacy": {
        "anchor": "L41–44",
        "quote": "\"La on autopilot … Kha's intervention point … La blocking its own examination\"",
        "type": "science",
        "verdict": "ALIGNED",
        "load_bearing": true,
        "note": "Kha-Ba-La operating as structural grammar in the 4-layer map; house cosmology, ALIGNED by definition (§9)."
      },
      "id": "C001"
    },
    {
      "anchor": {
        "line_start": 52,
        "line_end": 54,
        "quote": "Ba registers the signal before cognition touches it"
      },
      "claim_mode": "HOUSE-MODEL",
      "claim_status": "COHERENT",
      "remediation_codes": [
        "KEEP"
      ],
      "requires_review": false,
      "math": {
        "role": "NONE",
        "load_bearing": false,
        "locks": {
          "correctness": "NOT-APPLICABLE",
          "consequence": "NOT-APPLICABLE",
          "provenance": "NOT-APPLICABLE"
        },
        "evidence_eligible": false
      },
      "rationale": "Ba→La→Kha is the explicitly named Noesis signal/state/story model and is internally consistent with the intervention sequence defined around it.",
      "legacy": {
        "anchor": "L52–54",
        "quote": "\"Ba registers the signal before cognition touches it\"",
        "type": "science",
        "verdict": "ALIGNED",
        "load_bearing": true,
        "note": "House signal sequence (Ba→La→Kha); carries the intervention thesis. Consciousness-primary framing."
      },
      "id": "C002"
    },
    {
      "anchor": {
        "line_start": 60,
        "line_end": 60,
        "quote": "If a pattern repeats across relationships, projects, and emotional states"
      },
      "claim_mode": "HOUSE-MODEL",
      "claim_status": "COHERENT",
      "remediation_codes": [
        "KEEP"
      ],
      "requires_review": false,
      "math": {
        "role": "NONE",
        "load_bearing": false,
        "locks": {
          "correctness": "NOT-APPLICABLE",
          "consequence": "NOT-APPLICABLE",
          "provenance": "NOT-APPLICABLE"
        },
        "evidence_eligible": false
      },
      "rationale": "Repeated cross-context patterns are interpreted as architecture inside the explicitly developed field-cartography house model; the claim is a model rule, not an empirical prevalence estimate.",
      "legacy": {
        "anchor": "L60",
        "quote": "\"If a pattern repeats across relationships, projects, and emotional states\"",
        "type": "science",
        "verdict": "GROUNDED-OBSERVATIONAL",
        "load_bearing": true,
        "note": "Reader-replicable observation; no authority invoked; falsifiable by the reader's own audit."
      },
      "id": "C003"
    },
    {
      "anchor": {
        "line_start": 72,
        "line_end": 72,
        "quote": "The Enneagram is a debug surface, not a personality badge"
      },
      "claim_mode": "DECLARED-METAPHOR",
      "claim_status": "DECLARED",
      "remediation_codes": [
        "KEEP"
      ],
      "requires_review": false,
      "math": {
        "role": "NONE",
        "load_bearing": false,
        "locks": {
          "correctness": "NOT-APPLICABLE",
          "consequence": "NOT-APPLICABLE",
          "provenance": "NOT-APPLICABLE"
        },
        "evidence_eligible": false
      },
      "rationale": "Calling the Enneagram a debug surface is a plainly declared computing analogy used to guide questions, with no literal computational inference.",
      "legacy": {
        "anchor": "L72",
        "quote": "\"The Enneagram is a debug surface, not a personality badge\"",
        "type": "science",
        "verdict": "ALIGNED",
        "load_bearing": false,
        "note": "House diagnostic frame; no geometric/mathematical claims invoked, so not a math reference."
      },
      "id": "C004"
    },
    {
      "anchor": {
        "line_start": 79,
        "line_end": 79,
        "quote": "the stress response your nervous system defaults to when Kha stops watching"
      },
      "claim_mode": "HOUSE-MODEL",
      "claim_status": "COHERENT",
      "remediation_codes": [
        "KEEP"
      ],
      "requires_review": false,
      "math": {
        "role": "NONE",
        "load_bearing": false,
        "locks": {
          "correctness": "NOT-APPLICABLE",
          "consequence": "NOT-APPLICABLE",
          "provenance": "NOT-APPLICABLE"
        },
        "evidence_eligible": false
      },
      "rationale": "The sentence defines “type” inside the post’s Kha-Ba-La/Enneagram house vocabulary; Kha’s watching and nervous-system default are model terms used consistently, not an external biomedical result.",
      "legacy": {
        "anchor": "L79",
        "quote": "\"the stress response your nervous system defaults to when Kha stops watching\"",
        "type": "science",
        "verdict": "GROUNDED-OBSERVATIONAL",
        "load_bearing": false,
        "note": "Observable physiology; arrow runs consciousness-first (Kha's watching is the operator), not INVERTED."
      },
      "id": "C005"
    }
  ]
}
