{
  "schema_version": "2.3",
  "ledger_state": "RECERTIFIED",
  "post": "ancient-debugging-protocols.md",
  "source_path": "src/content/posts/ancient-debugging-protocols.md",
  "source_sha256": "1646ec2a78f63b6d1747ecced52a4a70253a063438f469e8d08f09bf13a675bd",
  "legacy_audit_path": "quality-engine/audits/nigredo/ancient-debugging-protocols.md-nigredo-audit.md",
  "claims": []
}
